{
  "$schema": "https://json-schema.org/draft/2020-12/schema",
  "$id": "naturalcontrol.actuation_injector_receipt.v1.schema.json",
  "title": "NaturalControl Actuation Injector Receipt v1",
  "description": "Actuation execution receipt for injector/backend-side acceptance and injection outcome.",
  "type": "object",
  "required": [
    "schema_id",
    "spec_version",
    "epoch_ns",
    "injector_receipt_id",
    "bundle_id",
    "execution_id",
    "injector_ref",
    "receipt_state"
  ],
  "properties": {
    "schema_id": { "const": "naturalcontrol.actuation_injector_receipt.v1" },
    "spec_version": { "const": "1.0" },
    "epoch_ns": { "$ref": "naturalcontrol.common.v1.2.schema.json#/$defs/nsValue" },
    "injector_receipt_id": { "$ref": "naturalcontrol.common.v1.2.schema.json#/$defs/identifier" },
    "bundle_id": { "$ref": "naturalcontrol.common.v1.2.schema.json#/$defs/identifier" },
    "request_id": { "$ref": "naturalcontrol.common.v1.2.schema.json#/$defs/identifier" },
    "interaction_id": { "$ref": "naturalcontrol.common.v1.2.schema.json#/$defs/identifier" },
    "execution_id": { "$ref": "naturalcontrol.common.v1.2.schema.json#/$defs/identifier" },
    "injector_ref": { "$ref": "naturalcontrol.common.v1.2.schema.json#/$defs/nonEmptyString" },
    "backend_kind": {
      "type": "string",
      "enum": ["uinput", "hidapi", "virtual_touch", "custom"]
    },
    "receipt_state": {
      "type": "string",
      "enum": ["accepted", "injected", "partial", "rejected"]
    },
    "packet_count": { "type": "integer", "minimum": 0 },
    "device_handoff_ref": { "$ref": "naturalcontrol.common.v1.2.schema.json#/$defs/nonEmptyString" },
    "error": {
      "type": "object",
      "required": ["code", "reason"],
      "properties": {
        "code": { "$ref": "naturalcontrol.common.v1.2.schema.json#/$defs/nonEmptyString" },
        "reason": { "$ref": "naturalcontrol.common.v1.2.schema.json#/$defs/nonEmptyString" }
      },
      "additionalProperties": false
    },
    "meta": { "$ref": "naturalcontrol.common.v1.2.schema.json#/$defs/metaObject" }
  },
  "allOf": [
    {
      "if": { "properties": { "receipt_state": { "const": "rejected" } }, "required": ["receipt_state"] },
      "then": { "required": ["error"] }
    }
  ],
  "additionalProperties": false
}
