{
  "schema_id": "naturalcontrol.actuation_injector_receipt.v1",
  "spec_version": "1.0",
  "epoch_ns": "1742060000011000000",
  "injector_receipt_id": "injector-receipt-001",
  "bundle_id": "bundle-011",
  "request_id": "req-click-001",
  "interaction_id": "interaction-blueclicker-001",
  "execution_id": "exec-001",
  "injector_ref": "injector/uinput-main",
  "backend_kind": "uinput",
  "receipt_state": "injected",
  "packet_count": 10,
  "device_handoff_ref": "device-node-event2"
}
